errStatus,section,location,message
yellow,parameter read-in,modelData/technology/par_capacityCosts.csv,values provided for undefined set 2915 (lvl 2)
green,timestep mapping,,superordinate dispatch level provided via options was used
yellow,technology mapping,carrier,technology y has no output
red,technology mapping,type,"unknown technology type  used, allowed are: mature, emerging, stock"
green,parameter read-in,validity check,non-unique entries discovered for capaExcResi
green,parameter read-in,validity check,non-unique entries discovered for costExpExc
